No.,논문명,저자명,발행기관명,간행물명,권,호,발행년도,ISSN,국문초록,영문초록,키워드,페이지,URL
31,사회복지사업법 제정사 연구,심재진 ( Jae Jin Shim ),한국사회보장학회,사회보장연구,27,2,2011,1225-5866,"한국 사회복지법제의 특징은 첫째로 국가책임의 미흡과 민간에의 의존, 둘째로 공적 사회복지서비스 전달체계의 부족이라고 할 수 있다. 이 글은 제정 사회복지사업법의 입법사를 연구대상으로 하여, 한국사회복지법제의 특징의 형성에 초점을 맞추어 제정사회복지사업법의 입법배경과 법안 그리고 국회논의과정을 추적하는 것을 연구의 주안점으로 한다. 사회복지사업법은 1960년대 두 가지 배경에서 탄생했다. 우선 사회복지서비스를 제공하는 민간단체에 대한 효율적인 관리와 감독의 필요했다는 점이다. 당시 국가는 거의 사회복지사업을 수행하지 않고, 외국원조단체의 지원을 바탕으로 민간단체들이 사회복지서비스의 대부분을 제공하였기 때문에 이러한 사회복지서비스 전달체계를 효과적으로 구축하고 관리할 필요가 있었다. 특히 민간영역에서 사회복지사업을 행하는 주체로서 ``법인``에 대한 규율을 일반화할 필요가 있었다. 두 번째로 1960년대 후반에 외국원조단체가 철수하기 시작하면서 사회복지사업법 제정이 직접적으로 촉진되었다. 당시 사회복지사업의 재정은 국가가 아니라 대부분 외국원조단체에 의존하고 있었다. 이러한 상황에서 외국원조단체 중 일부가 철수하게 되자 당시의 정부는 위기의식을 크게 느끼고 민간단체의 공동모금을 통해 사회복지사업의 재정을 충당하기 위해 사회복지사업법을 제정하였다. 이러한 배경에서 제안된 사회복지사업법안은 사회복지법인과 사회복지시설에 대한 조항이 대부분을 차지하였고, ``공동모금``이 가능하도록 하는 조항을 도입하였다. 반면에 사회복지사업법안에는 사회복지사업에 대한 국가책임에 대한 규정이 완전히 부재하였고, 그 연장선상에서 공적 사회복지서비스 전달체계에 대한 규정이 전혀 없었다. 이 법안이 국회에서 논의되는 과정에서도 의미 있는 토론이 진행되지 못했고, 사실상 정부가 제안한 법안이 거의 그대로 통과되었다. 사회복지의 국가책임과 이에 따른 재정문제는 전혀 토론되지 않았고, 사회복지공동모금회에 의한 공동모금의 관할부서에 관한 의견대립이 법안의 국회논의과정에서 실질적으로 논의된 내용의 전부이었다. 또한 공적 사회복지전달체계의 하나로서 사회복지사무소를 설치하자는 민간단체의 청원은 완전히 무시되었다. 결국 현재 한국 사회복지법제의 특징적인 2가지 측면은 1960년대의 제정 사회복지사업법에서 그 연원을 찾아볼 수 있다. 이렇게 볼 때 1960년대 이래 한국사회복지법제는 그 기본적 성격의 면에서 크게 바뀌지 않고 현재에 이르렀다고 볼 수 있다. 한국사회복지법제의 특징을 제정사회복지사업법이 제정된 과정에서 확인한 이 글은 사회복지사업법의 제정을 사회복지서비스 규율체계의 확립이나 혹은 외국원조단체의 철수에 따른 대응의 측면에서 바라보는 관점과 비교하면 더 종합적이라고 할 수 있다.","Current Korean legal system on social welfare is characterized by two distinguishing features: lack of state responsibility and dependency on private sphere; insufficiency of public infra structure on social welfare. This article explores their origin by means of socio-legal analysis of the introduction of the Social Welfare Services Act (SWSA) of 1970. The SWSA of 1970 was introduced in the two socio-legal contexts. The first was that the then Government sought to regulate non-profit incorporated organizations which, funded by foreign voluntary agencies, carried out most of the social welfare services needed for poor people, orphans, and so on. Although the Government did not play any meaningful role in funding such organizations or directly subsidizing those people, it had to monitor and supervise those organizations. In particular, terms and conditions under which the organizations were to be established and run had to be regulated given their significance for social welfare services. The second context behind the introduction of the SWSA of 1970 was that foreign voluntary agencies started to withdraw from Korea in the late 1960s. The amount of the fund that they donated for social welfare services comprised most of the budget actually spent in the 1960s for social welfare services. In preparation of their withdrawal, the then Government sought for an alternative to such foreign aid instead of financially taking the charge of social welfare. In these contexts, provisions on corporations for social welfare, accounting for 16 of 25 sections of the SWSA of 1970 in total, mainly constitutes the Act. Under the Act, all charitable organizations would have to be chartered as a corporation for social welfare in order to perform social welfare services. Consitutional rules for a newly created corporation for social welfare were provided for in the Act. Furthermore a provision in which all charitable organizations were entitled to jointly raising funds for social welfare was made in the Act. However there were no provision for state responsibility for social welfare and the establishment of local administrative offices for social welfare. The then government ignored the petition by a main body representing all non-profit organification for social welfare services for the establishment of such offices. This legislative stance is contrasted with the Japanese SWSA of 1951 from which the Korean Act borrowed its legislative framework. The Japanese Act clearly provided that the state had the responsibility of providing social welfare services and was obliged to establish local administrative offices for social welfare. Overall it is certain that the two main features regarded as the main characteristics of Korean legal system on social welfare is dated back to the 1960s when the SWSA of 1970 was introduced. The features, although gradually modified over last four decades, since have not changed. These findings will go further than previous studies on the legislative history of the Act in the sense that the former approaches the introduction of the Act more thoroughly both in a socio-legal context and in systemic development of social welfare law.","사회복지사업법, 사회복지법인, 사회복지시설, 외국원조단체, 법제정, 사회복지법제, Social Welfare Services Act, Corporation for Social Welfare, Social Welfare Facilities, Social Welfare Services, Legal System on Social Welfare",279 ~ 307,http://kiss.kstudy.com/search/detail_page.asp?key=2916714
32,건강보험재정과 국민경제 연계를 위한 고찰 -거시적 수가체계로서의 접근-,"김진수 ( Jin Soo Kim ) , 정창률 ( Chang Lyul Jung )",한국사회보장학회,사회보장연구,27,2,2011,1225-5866,"사회복지재정 가운데에서 연금과 건강보험은 규모나 중요성 면에서 다른 제도들에 비해 압도적으로 크며, 특히 부과방식인 건강보험의 경우 노령화 등에 의해서 그 지출 증가가 국민의료비에 직접적으로 연결될 뿐 아니라 향후 지출 규모도 예측하기 어렵다는 점에서 다른 어떤 사회복지제도보다 건강보험재정이 전체 사회복지재정에 미치는 영향이 큰 것이 사실이다. 이 연구는 건강보험재정에 대해서 지불방식 개편에 머물러 있던 고정관념을 넘어서, 보다 거시적 접근으로서 환산지수 산정에 대한 새로운 접근을 제시한다. 2001년부터 시작된 환산지수 연구의 연속선상에서, 기존의 연구 방법론-원가분석모형, 지수모형, SGR 모형-에 의한 연구 결과를 제시함은 물론, 국민경제 발전수준과 총 건강보험 지출을 연동시키는 새로운 접근을 대안으로 제시한다. 이 대안은 아직까지는 가설 단계이지만, 현재 건강보험재정의 최종 조절기제로서 전혀 제 역할을 하고 있지 못하는 환산지수를 건강보험 지출을 통제하는 기제로서 설정했다는 점에서 중요한 의의가 있다. 앞으로 이 연구에서 새롭게 제시한 비용통제 방식과 목표진료비를 설정하는 기존의 SGR 모형을 적절히 조화시킬 수 있는 건강보험 수가체계에서의 패러다임 전환이 요구된다.","The interest in social welfare finance is recently increasing. Of social welfare finance, pension and health insurance are overwhelmingly bigger than other welfare systems in size and importance. In particular the National Health Insurance (NHI) based on PAYG is increasing the expenditure with the socioeconomic changes such as the rapid ageing and, it is more difficult to estimate the future expenditure in NHI. The study suggests the new perspective of conversion factor throughout the macro perspective. Considering the previous studies on conversion factor, the study not only shows the results by the existing research methods-the prime cost analysis model, the index model and the SGR model-but also suggests the new approach which relates the total NHI expenditure to national economy development. The alternative is still a sort of hypothesis but, it is an important trial because it set conversion factor as a mechanism to control the total NHI expenditure. In the future, it is necessary to transform the NHI system to harmonize the cost control mechanism which is suggested in the study and the existing SGR model which set the target expenditure.","사회복지재정, 건강보험재정, 지불방식, 환산지수, SGR 모형, 비용 통제, social welfare finance, NHI finance, conversion factor, paying method, SGR model, cost control",309 ~ 330,http://kiss.kstudy.com/search/detail_page.asp?key=2916715
33,복지에 대한 정부역할 인식의 비교분석,"김태일 ( Tae Il Kim ) , 최하정 ( Ha Jeong Choe )",한국사회보장학회,사회보장연구,27,2,2011,1225-5866,"본 연구에서는 우리나라 국민의 복지에 대한 정부 역할 인식을 종단면 및 횡단면 비교를 통하여 분석하였다. 종단면적 비교를 위해서는 1970년대 말, 1990년대 중반, 2000년대 중반의 자료를 비교 분석하였다. 횡단면적 비교를 위해서는 2006년 국제조사 자료를 이용하여 우리나라와 외국 7개국의 결과를 비교하였다. 1970년대 말, 1990년대 중반, 2000년대 중반 자료의 비교 결과는, 비록 문항과 척도가 동일하지 않음에 따른 해석의 한계는 있지만, 1970년대 말→1990년대 중반→2000년대 중반으로 오면서 정부의 복지 역할 확대를 지지하는 경향이 크게 증가하였음을 보여 준다. 우리나라와 외국 7개국의 비교 결과는, 복지의 세부 영역에 따라 다양한 모습을 보여주고 있다. 종단면 및 횡단면 분석에 의하여 다음과 같은 경향을 알 수 있었다. 첫째, 우리나라는 1990년대 중반→2000년대 중반 사이에 교육지원을 제외한 나머지 복지 영역에서 정부의 책임이라는 인식이 증가한데 비하여, 외국은 그렇지 않다. 전국민을 대상으로 하는 의료와 노후보장, 그리고 교육지원이 정부 책임이라고 인식하는 수준은 거의 일정하다. 한편 외국의 경우 실업대책, 즉 일자리제공과 생계지원이 정부책임이라는 인식은 1990년대 중반→2000년대 중반 사이에 감소하였으며, 소득격차해소의 경우만 다소 증가하였다. 둘째, 의료나 노후보장처럼 전국민을 대상으로 하는 복지제도의 경우 우리나라는 외국에 비하여 다소 낮지만 90% 이상이 정부책임으로 인식하고 있어서 국가에 따른 차이가 별로 없다. 이에 비하여 실업대책과 소득격차해소는 비교대상 국가들에 비하여 우리나라에서 정부책임이라는 인식이 더 높았다. 이상과 같은 본 연구의 분석 결과는 향후 우리나라 복지제도의 방향에 대하여 다양한 시사점을 던져준다.","The purpose of this paper is to examine the changes of public attitude to welfare state in Korea. For last 30 years, Korean welfare system has rapidly expanded. Institutionalists argue that institutions affect on attitudes. If we accept this arguments, we might expect that the welfare attitude of Koreans has been changed to support welfare state expansion. Using data from the International Social Survey Program modules on ``The Role of Government`` 2006, attitudes towards government responsibilities to various welfare programs are compared between Korea and 7 other countries. Also the results of Korea are compared to those of 1980`s and 1990`s. The results show that the welfare attitude of Koreans has been changed to pro welfare state. This provide some support for the attitude forming effects of institutions.","정부역할, 복지인식, 복지정책, role of government, welfare attitude, welfare policy, ISSP",331 ~ 356,http://kiss.kstudy.com/search/detail_page.asp?key=2916716
34,베이비부머의 은퇴 준비와 준비 유형 결정요인 분석,백은영 ( Eung Young Baek ),한국사회보장학회,사회보장연구,27,2,2011,1225-5866,"본 연구는 우리나라 총 인구의 15%를 차지하고 있는 베이비부머들의 은퇴가 최근 시작된다는 사회적 이슈에 따라 현재 베이비부머들의 은퇴 준비현황에 대해 구체적으로 분석해 보고자 하였다. 분석결과, 약 79% 가량의 베이비부머들은 어떠한 방식으로든 은퇴준비를 하고 있다고 응답하였으며, 이 중공적연금을 주된 은퇴준비 방법으로 활용하고 있는 경우는 46%가량이었다. 베이비부머들의 주된 은퇴준비 방법은 국민연금(38.94%)으로 준비하는 경우가 가장 많았고 예적금 및 저축성 보험(24,39%), 개인연금(18.72%), 부동산(5.5%) 순으로 나타났다. 은퇴준비 유형별 영향요인을 살펴본 결과, 소득이나 교육수준이 높은 경우 개인연금을 주된 은퇴준비 유형으로 선택할 확률이 높음을 알 수 있었고, 예적금 및 보험은 적극적으로 이 방법을 통해 은퇴준비를 하고 있다기 보다는 수동적인 선택에 불과한 것으로 나타났다. 부동산을 주된 은퇴준비 방법으로 선택한 경우는 주택의 소유나 높은 소득 등 경제적인 요인들과 관련되어 있었는데, 부동산 또는 주택을 주된 은퇴준비의 방법으로 선택할 경우에 대한 실무적 제언이 제공되었다. 또한 국민연금을 주된 은퇴준비의 방법으로 선택할 경우 추가적으로 고려해야 할 사항과 베이비부머들의 본격적 은퇴에 앞서 이들의 은퇴준비에 대한 정책적 제언이 제공되었다.","The baby boomers consists of about 15% of the total population and they started to retire in 2010. Due to the size of this group of people, their retirement has become a social issue in Korea. The purpose of this study was to analyze the baby boomers retirement preparation and the preparation types of retirement. The results showed that about 80% of baby boomers were preparing for their retirement. Among them, 46% were preparing for their retirement through public pension plan. Other than public pension plan, many baby boomers chose savings and cash-value life insurance (24.39%) as their major retirement preparation methods followed by annuity(18.72%). Among the baby boomers, 5.5% chose real estate as their major retirement preparation methods. The results of the multinomial logit analysis indicated that the choice of annuity was related to higher level of education and income, and the choice of real estate was related to financial factors such as higher level of income and home ownership. The implication on retirement preparation for the baby boomers, policy makers, and future study was provided.","베이비부머, 은퇴준비, 은퇴준비 유형, 다항로짓분석, Baby boomers, Retirement preparation, Types of retirement preparation, Multinomial Logit analysis",357 ~ 383,http://kiss.kstudy.com/search/detail_page.asp?key=2916717
35,장애인-비장애인의 취업확률 및 임금 격차 분석,오욱찬 ( Uk Chan Oh ),한국사회보장학회,사회보장연구,27,1,2011,1225-5866,"본 연구는 한국복지패널 3차년도(2008년) 자료를 이용하여 비장애인과 장애인의 취업확률 및 임금에서의 실질격차를 추정하고 격차 분해를 통해 원인을 분석하였다. 실질격차 추정에서 취업모형은 로지스틱 회귀분석, 임금모형은 Heckman의 2단계 추정법을 사용하였으며, 격차 분해에는 Oaxaca-Blinder(1973)의 방법을 응용한 Fairlie(2005)와 Reimers(1983)의 모형을 사용하였다. 먼저 실질격차에 대한 추정 결과, 비장애인과 장애인의 표면적인 취업확률 격차는 24.8%p였으나 실질격차는 16.1%p로 나타나 장애인의 취업확률은 비장애인의 72.4% 수준이었다. 또한 장애인의 월평균 임금은 비장애인의 69.5% 수준이나 시간당임금을 사용하고 개인 특성과 표본선택편의까지 통제하면 88.2%로 나타난다. 즉, 비장애인과 장애인 임금의 실질격차는 11.8%라고 할 수 있다. 이를 생산성 격차와 차별 격차로 분해한 결과, 취업확률에서는 총격차의 35.3%가 생산성 격차, 64.7%가 차별 격차로 나타났으며 임금에서는 총격차의 57.3%가 생산성 격차, 42.7%가 차별 격차로 나타났다. 이를 통해 장애인은 노동시장 내부(임금)에서보다 진입 단계(취업)에서 더 낮은 성과를 보이고 차별의 영향도 더 크게 받는다는 것을 알 수 있다. 이러한 분석 결과는 장애인 노동시장 성과지표로서 실질격차 추정의 중요성을 시사함과 동시에 장애인의 노동시장 참여를 위한 정책, 특히 노동시장 공급 측면에서의 정책 강화가 무엇보다 중요함을 의미한다.","This article estimates the actual extent of differentials in employment probability and wage between people with and without disabilities in Korean labor market. The paper also decomposes the differentials into productivity and discrimination components utilizing data from Korean Welfare Panel Study(KoWePS), 2008. The employment probability differentials were 24.8%p. However, when controlling individual characteristics affecting employment, the actual differentials turned out to be 16.1p%. This implies that the actual employment probability level of people with disabilities is 72.4% of those without disabilities. As for monthly wage level, people with disabilities turned out to be only 69.5% of those without disabilities. When hourly wage was used as a dependent variable, controlling variables affecting wages, the wage level of people with disabilities turned out to be 88.2% of those without disabilities. Decomposition of the differentials shows that discrimination differentials were 64.7% of the total employment differentials and 42.7% of the total wage differentials. This implies that people with disabilities achieve poorer outcomes in labor market entry stage (employment) compared to when they are employed (wage). Thus, in order to reduce labor market differentials between people with and without disabilities, the reinforcement of labor supply policies should be considered firsthand.","장애, 취업확률 격차, 임금 격차, 격차분해, 노동시장 차별, disability, employment differential, wage differential, decomposition technique, Labour market discrimination",1 ~ 25,http://kiss.kstudy.com/search/detail_page.asp?key=2893270
36,노인수발 관련 법제도 분석: 가족수발자 지원에 대한 정책적 함의,조미경 ( Mi Kyeong Cho ),한국사회보장학회,사회보장연구,27,1,2011,1225-5866,"최근 노인수발을 둘러싼 사회 환경의 변화로 인해 가족수발의 한계가 인식되고 가족의 수발부담에 대한 관심이 증대하고 있음에도 불구하고 여전히 가족수발자를 지원하기 위한 정책의 발전은 지체되고 있다. 이에 본 연구는 노인복지정책 속에 내포되어 있는 가족수발에 대한 가정들이 허약한 노인을 돌보는 가족들의 실제 수발경험과 어느 정도 일치하는가를 조사하고자 한다. 이를 위해 먼저 노인수발 관련 법제도를 분석하여 가족수발의 특성과 이용가능성에 대한 가정들을 조사하고 가족수발자 지원정책의 현황과 문제점을 살펴본 다음에 가족수발에 대한 정책적 가정과 가족의 노인수발경험을 비교하여 논의하였다. 연구결과, 노인복지정책은 여전히 전통적인 효의 이념에 근거한 가족수발에 의존하고 있으며 노인수발에 대한 가족(여성)의 일차적 책임과 친족관계망 내에서 수발책임의 공유와 비공식적 도움의 동원에 대한 가정과 기대들을 내포하고 있고, 이러한 가정과 기대들은 가족의 노인수발현실과는 다소 괴리가 있음을 확인하였다. 결론에서는 노인을 돌보는 가족수발자를 지원하기 위한 정책 개발에 대한 제언을 하였다.","Radical social and economic changes have affected the context in which families give care to their older relatives. Despite the increased awareness of the limitations of family care and the caring burden and family carers, the policy development for family carers of older people has been delayed. This study examines what assumptions concerning family care are made in social policies and how far those assumptions are in accord with the realities of families giving care to older people. To do so, it analyses the law and system relating to the care of older people, exploring the assumptions and expectations about the nature and availability of family care, and examines the present state and problems of welfare provision for supporting carers, and discusses the gap between the policy assumption and the reality of family care. According to the findings, the social welfare policies for older people still rely on family care based on the traditional value of filial piety, and reflect the assumptions and expectations about the family`s(woman`s) primary responsibility for the care of older relatives and family members sharing the responsibility for caring and mobilising informal help within kinship networks, and those assumptions differ in some ways from the actual caring experience of families. Finally, this study makes suggestions of the policy development for supporting family carers of older people in Korea.","노인수발, 정책적 가정, 수발경험, 가족수발자 지원정책, caring for older people, policy assumption, caring experience, policy for supporting family carers",27 ~ 53,http://kiss.kstudy.com/search/detail_page.asp?key=2893271
