No.,논문명,저자명,발행기관명,간행물명,권,호,발행년도,ISSN,국문초록,영문초록,키워드,페이지,URL
16,사회보장협정의 경제적 효과 -해외파견근로자의 외국 사회보장비용 면제를 중심으로-,백수현 ( Soo Huyn Baek ),한국사회보장학회,사회보장연구,27,3,2011,1225-5866,"본 연구는 우리나라가 외국과 체결한 사회보장협정에 의한 경제적 효과를 측정해보고 향후 우리나라의 협정추진 정책방향의 시사점을 얻기 위한 것이다. 우리나라는 해외에 진출해 있는 우리기업의 외국 사회보장 비용부담 해소차원에서 1990년대 중반부터 외국과 사회보장협정을 적극적으로 추진해오고 있다. 그간 우리나라가 외국과 체결한 사회보장협정은 미국 등 12개국과는 가입기간합산 협정을, 영국 등 7개국과는 보험료면제 협정을 체결하여 2010년 6월말 현재 총 19개 국가와 협정을 시행하고 있다. 협정체결에 따른 경제적 효과는 2010년 6월말 기준으로 우리나라 파견근로자의 협정국보험료 면제액 869,384백만원에서 우리나라에 파견된 협정국 근로자의 한국 보험료면제액 103,115백만원과 협정국 국민에게 지급한 국민연금반환일시금 129,930백만원을 차감한 636,339백만원으로 측정되었다. 본 연구에서는 이 같은 협정의 경제적 효과를 바탕으로 우리나라가 향후 외국과의 사회보장협정을 지속적으로 추진하되, 다음과 같은 두 가지 정책방향에서 협정을 추진할 것을 제시하고 있다. 첫째, 우리나라 파견근로자가 많은 국가와 협정을 추진하되, 선진국을 우선순위로 추진하는 것이 바람직하다. 둘째, 외국과의 사회보장협정은 가입기간합산 협정을 우선적으로 추진하고, 보험료면제협정은 차선으로 추진해야 할 것이다.","The purpose of this paper is to obtain implications for social security agreement policy of Korean government in the future, based on the economic effectiveness of social security agreements that Korean government concluded with foreign countries. Since the mid-1990s, Korean government has aggressively pursued social security agreements with foreign countries to alleviate foreign social security costs burden of overseas Korean enterprises. As its result, Korean government has implemented social security agreements with 19 countries as of the end of June, 2010: totalization agreements with 12 countries including the U.S.; contributions only agreements with 7 countries including the United Kingdom. The economic effectiveness of social security agreements concluded by Korean government is measured in 636,339 million KRW as of the end of June, 2010. The amount is calculated by subtracting the amount exempted from Korean contributions of foreign workers(103,115million KRW) and the National Pension lump sum refund paid to foreign workers by Korean government(129,930 million KRW) from the amount exempted from foreign social security contributions of Korean workers(869,384 million KRW). Based on the economic effectiveness of the agreements mentioned above, this paper suggests that Korean government aggressively expand social security negotiations with foreign countries, based on the following two policy directions. First, it is desirable that social security negotiations be made by priority with the advanced countries to which lots of Korean workers are detached. Second, it is required that social security negotiation be made preferentially for totalization agreement and then for contributions only agreement as an alternative.","사회보장협정, 가입기간합산 협정, 보험료면제 협정, 협정의 경제적 효과, social security agreement, totalization agreement, contributions only agreement, the economic effectiveness of agreement",59 ~ 89,http://kiss.kstudy.com/search/detail_page.asp?key=2945248
17,소득계층에 따른 의료이용의 격차: 연령집단별 Le Grand 지수 분석을 중심으로,김진구 ( Jin Gu Kim ),한국사회보장학회,사회보장연구,27,3,2011,1225-5866,"본 연구는 국민건강영양조사 4기 3차 자료를 이용하여 소득계층에 따른 의료이용의 격차를 분석하였다. 분석에는 집중지수와 Le Grand지수가 사용되었으며, 특히 구체적인 접근을 위하여 연령층에 따라 집단을 구분하여 추가분석을 실시하였다. 연령집단별 추가분석에서 새롭게 발견한 결과들을 요약하면 다음과 같다. 첫째, 전 연령층 분석에서 저소득층에 불리한 건강상태의 격차가 존재하였으나, 연령집단별 분석에서 이러한 격차는 크게 완화되었다. 따라서 소득계층별 건강상태의 격차는 연령에 의해 크게 영향을 받는다. 둘째, 전 연령층분석에서 외래진료횟수는 저소득층에 유리한 격차가 존재하였으나, 연령집단별 분석에서는 차이가 거의 없거나 크게 줄어들었다. 따라서 외래진료 횟수의 저소득층에 유리한 결과는 저소득층에 노년층이 집중적으로 분포된 연령효과가 크게 영향을 미친 것으로 파악되었다. 셋째, 전 연령층분석에서 외래진료비총액은 고소득층에 유리한 불평등이 존재하였는데, 연령집단별 분석에서는 청장년층에서는 그 정도가 줄어든 반면, 노년층은 크게 확대되었다. 넷째, 전 연령층분석에서 입원비 총액은 저소득층에 유리한 격차가 있는 것으로 나타났으나, 연령집단별 분석에서 노년층은 고소득층에 유리한 불평등이 있는 것으로 반전되었다. 연령집단별 분석결과 소득계층별 연령분포의 차이로 인하여 연령은 건강과 의료이용의 격차에 크게 영향을 미친다. 특히 노인의 빈곤화에 따른 노년집단의 저소득층 집중현상이 노년층의 건강이나 의료이용 특성을 저소득층의 통계적 특성으로 크게 반영시켜 형평성에 영향을 미치기 때문에 노년층의 영향은 절대적이었다. 따라서 건강과 의료이용의 격차를 개선하기 위해서는 저소득노인들의 의료이용을 높일 수 있는 의료보장정책의 수단들이 모색되어야 한다.","This study analyzed the differences in the delivery of health care in term of income levels using the databases out of National Health and Nutrition Survey of 2009 (KNHANES Ⅳ-3). The main measurement tools of the analysis were the Concentration Index and Le Grand Index. The Analysis was not only applied to all the age but also three age groups(young age, middle age, old age). The main results of this study were the followings. First, there were sizable differences in health level of all the age, but in analysis by age groups the differences diminished; therefore, the differences in health level were not only influenced by income but also age. Second, the number of visiting outpatient clinic of low income groups was high in all the age, but in analysis by age groups it was not so. Third, the average cost per visit and total cost of health care were significantly higher in the high income groups. The differences were particularly higher in old age group than others in analysis by age groups. Fourth, in hospital services, the average cost per service and total cost of low income group were higher than that of high income groups. But, in analysis by age groups, the results of old age group were directly opposite. This study revealed that age was one of the important factors in health level and health care utilization, in particular, the impact of old age were crucial.","의료이용의 형평성, 건강의 형평성, 집중지수, Le Grand지수, Equity in Delivery of Health Care, Equity in Health Levels, Concentration Index, Le Grand Index, HILG",91 ~ 122,http://kiss.kstudy.com/search/detail_page.asp?key=2945249
18,20-30대 직장여성의 결혼과 출산: 선택의 기로에 선 그녀들의 심경,"이훈희 ( Hun Hee Lee ) , 서용석 ( Yong Sug Suh ) , 정윤태 ( Yum Tae Jung )",한국사회보장학회,사회보장연구,27,3,2011,1225-5866,"본 연구는 저출산의 원인으로써 가족형성 지연 문제의 중요성을 부각시키기 위하여, 미혼직장여성의 결혼과 출산에 대한 인식유형을 구분하고, 각 유형별 특성과 유형별 차이점을 파악한다. 수집된 자료는 QUANL PC 프로그램으로 처리하였으며, 주요인분석을 실시하였고 요인회전방식은 배리맥스를 이용하였다. 분석 결과 제1유형은 ``미혼지위 안주형``, 제2유형은 ``전통적 가족지향형``, 제3유형은 ``결혼제도 비판형``으로 분석되었다. 본 연구에서 확인된 결혼에 대한 3가지 유형은 비혼자와 만혼자의 증가 및 출산율의 하락에 대해 고민하는 시점에서, 20-30대 여성들의 결혼에 대한 단순한 의사표현을 넘어 다양한 관점을 파악할 수 있게 하고, 객관적이고 학술적인 내용을 제공할 수 있다는 데 의의가 있다. 그리고 더 나아가 출산장려정책의 형성과 집행에 대한 기초적이고 객관적인 자료가 될 것으로 기대한다.","The purpose of this study is to highlight the delayed family formation problem as the cause of low fertility, classify the type of perception of unmarried working women for Marriage and observe the difference and characteristic by perception type. The subject for the study using Q method was the working women in 20~30`s. For the Q sample, the questionnaires with 24 questions were prepared through depth interview with 5 out of subject, literature and TV debates. After the objective and method of this study was explained to subject to get approval, questionnaires were prepared to find out the demographic characteristic and distributed them according to 7 points Q-sample distribution. The sampled data were processed with QUANL PC program to analyze the main factors, and Varimax was used for factor rotation method. The findings were classified into 3 types. At the time of worrying about the increase of non-marriage and late marriage and decline of fertility, the 3 types of perception of women in 20~30`s on Marriage would be meaningful in terms that the findings allow us to grasp various perspectives beyond their simple expression and provide objective and academic contents. In addition, it is expected that the findings would be fundamental and objective materials in formation and execution of childbirth policy.","결혼, 저출산, Q방법론, 인식유형, Marriage, Low fertility, Q method, Type of perception",123 ~ 142,http://kiss.kstudy.com/search/detail_page.asp?key=2945250
19,우리나라의 세대 간 소득 이동성 분석 -아버지와 아들을 중심으로-,"최지은 ( Ji Eun Choi ) , 홍기석 ( Ki Seok Hong )",한국사회보장학회,사회보장연구,27,3,2011,1225-5866,"본 연구는 세대 간 소득 탄력성계수를 추정하여 우리나라의 세대 간 소득 이동성에 대한 함의를 도출하였다. 실증분석을 위해 한국노동패널조사(KLIPS) 1차~11차 자료 중 원가구의 가구주인 아버지와 분가한 가구의 가구주가 된 아들의 자료를 연결한 총 369쌍의 표본을 설정하였다. 항상소득에 대한 대리변수(proxy)는 연간 및 월평균 근로소득을 이용하였고 모든 변수를 평균하였으며 생애주기 변동을 통제하고자 부모와 자녀의 연령 및 연령제곱을 설명변수로 추가하였다. 분석방법은 최소제곱(Ordinary Least Square) 및 도구변수(Instrumental Variable) 추정방법을 사용하였고, 자녀의 소득분위별 세대 간 소득 이전 정도를 분석하고자 분위회귀분석(Quantile Regression)을 추가적으로 실시하였다. 분석한 결과, 첫째 아버지와 아들의 근로소득은 강한 상관관계를 갖는 것으로 나타나 우리나라의 세대 간 이동성이 낮다는 가능성을 찾게 되었다. 둘째, 분위회귀분석 결과 연간 근로소득을 기준으로 최하위 분위에 속한 아들의 경우 아버지 소득의 영향력은 상당히 큰 것으로 나타났다. 이는 부모의 소득이 낮아질 때, 하위분위에 있는 자녀 소득 역시 급격히 감소할 수 있음을 시사한다.","This study analyzes the extent of intergenerational income mobility in Korea, using KLIPS (Korea Labor and Income Panel Study) database from 1998 to 2008. In particular, this study examines 369 father-son pairs from KLIPS to estimate father-son correlations in labor earnings. Main conclusions of the paper are as follows: (1) Intergenerational correlation in labor earnings is about 0.4, indicating that income mobility in Korea may not be as high as some believe; (2) Quantile regressions reveal that the father-son correlation is particularly strong in low percentiles of the son`s income. These results imply that poverty may be passed on from one generation to another.","세대 간 이동, 소득 이전, 도구변수추정법, 분위회귀분석, intergenerational mobility, transmission of income, IV estimates, quantile regression",143 ~ 163,http://kiss.kstudy.com/search/detail_page.asp?key=2945251
20,국민연금제도 도입 및 가입 전 장애에 대한 장애연금 적용가능성 검토 및 재정소요액 추정,"강성호 ( Sung Ho Kang ) , 이지은 ( Ji Eun Lee )",한국사회보장학회,사회보장연구,27,3,2011,1225-5866,"국민연금 장애연금 수급자 비중이 등록장애인 대비 3%수준에 미치지 못하고 최근 장애인연금제도가 도입되었지만 여전히 소득보장성이 미흡한 바, 본 연구에서는 국민연금제도 도입 및 가입 전 장애에 대해서도 장애연금을 확대적용함으로써 장애인의 소득보장을 확대하는 것을 검토하고 있다. 분석결과에 의하면, 연금제도 도입 및 가입 전 장애에 대한 연금수급권 인정은 사회보험원리 및 재정안정에 다소 부정적인 영향을 미칠 수 있으나, 장애인소득 및 복지 증진, 형평성 제고, 근로유인 제고, 노동기회 박탈에 대한 보상이라는 측면에서는 긍정적인 효과가 있을 것으로 분석되었다. 따라서 일정 기간의 기여를 전제로 하고 일정 연령이상의 장애인을 대상으로 장애연금 수급기회를 확대보장 하고자 하는 취지는 사회보험원리 약화 및 재정불안정 문제를 고려한 상태에서 장애인에 대한 소득보장을 강화할 수 있다는 시사점을 제시하고 있다.","On the point of view that the percentage of disability pension recipient is remaining at 3% of the registered disabilities, that means that the income security function of disability pension is insufficient, and expanding the disability pension for the disabled prior to the national pension system introduction & affiliation was analyzed from several perspectives. The result revealed that the guarantee of disability pension for the disabled prior to the national pension system somewhat weakens the social insurance principle or negative in the financial problem. However, it is thought to have positive effects on the aspect of promoting welfare such as incomes for the disabled as well as enhancing equality, motivation to work and compensation for the deprivation of labor opportunity. Overall, expanding and ensuring the disability pension right for the disabled prior to the introduction & affiliation has positive effects, and we suggested special disability pension system with partial contribution in order to be faithful to the social insurance principle. Accordingly, in the sense that it can ensure the opportunity for the disabled in certain age groups to receive disability pension without causing financial problem, it presents an implication on income guarantee for the disabled and the enhancement of trust on the national pension system.","장애연금, 제도 도입 및 가입 전 장애, 수급권 확대, disability pension, disabilities prior to the system introduction & affiliation, expansion of the right to receive",165 ~ 193,http://kiss.kstudy.com/search/detail_page.asp?key=2945252
21,한국의 복지태도와 건강보험 인식의 결정요인,"이훈희 ( Hun Hee Lee ) , 김윤태 ( Yun Tae Kim ) , 이원지 ( Won Jie Lee )",한국사회보장학회,사회보장연구,27,2,2011,1225-5866,"복지태도에 대한 상당수의 연구는 공공의료보장제도인 건강보험을 다루는 연구가 많다. 많은 학자들은 복지정책의 영역에 속하는 건강보험에 대한 인식이 사회구성원의 복지태도와 유사할 가능성이 높다고 본다. 그러나 이 논문은 복지태도와 건강보험 인식을 구분하여 분석한다. 건강보험은 보편적인 사회보험이지만 선별적으로 이루어지는 공공부조 등 대다수의 복지정책과 차이가 있기 때문에 두 변수 사이에 부합하지 않는 면이 있는지 살펴보고자 한다. 이 연구는 ``2007 한국복지패널조사`` 자료를 이용하여 건강보험 인식과 복지태도에 대한 결정요인을 분석한다. 분석 결과는 다음과 같다. 첫째, 인구·사회경제적 특성과 건강상태 사이의 연계성은 상당히 큰 것으로 나타났다. 둘째, 인구·사회경제적 특성은 복지태도에 직접적인 영향을 미치고 건강상태를 매개로 간접적 영향을 미치는 것으로 나타났다. 셋째, 인구·사회경제적 특성은 건강보험 인식에 직접적 영향을 미치고 건강상태와 복지태도를 매개로 간접적 영향을 미치는 것으로 나타났다. 넷째, 복지태도가 건강보험 인식에 유의한 영향을 미치는 것으로 나타났다. 마지막으로, 복지지위에 따라 집단을 구분한 분석 결과를 보면 복지의 이해관계에 따라 복지태도가 결정된다는 복지지위론의 가정을 부분적으로 확인할 수 있다.","Many studies on welfare attitudes are concerned about health insurance. It is assumed that welfare attitudes are closely connected with the awareness toward health insurance. Many scholars argued that the awareness toward health insurance is an integral part of general welfare attitudes. Unlike many conventional studies, this paper examines the difference between welfare attitudes and the awareness toward health insurance. While health insurance is a universal social insurance, other welfare policies including public assistance are based on means test. This paper looks into the correlations of two variables between welfare attitudes and the awareness toward health insurance, analyzing ``Korea Welfare Penal in 2007`` data. The conclusions are as follows. First, socio-demographic characteristics and welfare attitudes showed positive correlations. Second, socio- demographic characteristics influenced welfare attitudes directly and indirectly depending on their health conditions. Third, socio-demographic characteristics influenced the awareness toward health insurance directly and indirectly depending on their health conditions and welfare attitudes. Fourth, welfare attitudes have a positive correlation with the awareness toward health insurance. Finally, this paper argues that to some extent welfare attitudes are influenced by the welfare status.","복지태도, 건강보험, 인구,사회경제적 특성, 계급, 복지지위, 복지정책, Welfare attitudes, health insurance, socio-demographic characteristics, class, welfare status, welfare policy",1 ~ 25,http://kiss.kstudy.com/search/detail_page.asp?key=2916704
22,젠더적 관점에서 본 한국의 복지체제유형 논의 -남부유럽과의 비교를 중심으로-,안세아 ( Se Ah Ahn ),한국사회보장학회,사회보장연구,27,2,2011,1225-5866,"본 연구는 한국사회의 복지체제논의에 있어서 그 기준을 개인복지에서의 국가-시장-가족의 기여 비율을 복지체제 분류의 근간으로 기존 논의 가운데 가족정책안에서의 비교로 젠더레짐의 측면에서 고찰하고자 하였다. 기존의 Esping-Andersen의 세 가지 복지체제유형에 추가하여 남부유럽국가와 한국의 복지제도의 특성을 담을 새로운 복지유형에 대하여 살펴보고자 한다. 이는 젠더중심의 복지국가유형론에 근거하여 한국과 이탈리아, 스페인, 그리스, 포르투갈 등과 같은 남부유럽국가를 잔여주의적 보수주의 복지체제라는 독자적인 복지레짐으로 보고 한국과 남부유럽국가들의 복지제도 가운데 육아휴직제도와 부모휴가의 특성을 중심으로 살펴보고자 한다. 비록 이러한 분류 기준이 Esping-Andersen이 삼고 있는 탈상품화수준 정도로 유형을 측정하는데 한계를 가지고 있는 측면이 존재하나 가족정책의 범위안에서 젠더적관점으로 복지체제를 분류하는데 있어 복지정책을 생산하는 주체나 복지기여도 측면으로 체제별 대상별로 당면하는 사회적위험에 사회복지의 제도 개선 등으로 적절한 대응을 유도하는 데 본 논문의 의의를 명시하고자 한다.","The purpose of this study is to analyse welfare regime from a gender point of view between Korea and welfare reform in Southern Europe and to compare the care work support policy with those countries. The reason being focused the policy character is that is, even though two countries have implemented different policies under the heading of work-family balance, may produce similar policy outcome in terms of birth rate and achievement level of gender-equality in family. The results of analysis of this study are as such: Firstly, those countries`s family policy character has residual welfare provision including conservatism. Second, child care policy was concentrated on support for low income family`s needs for child care rather than women`s labourer`s needs. But private child care facilities for profit are dominant in Korea. So access to those facilities is very difficult for the class including the middle class which is not supported by government, because of too expensive child care fee. As a result, father`s participation ratio at parent leave scheme became decreased. Therefore, perfect gender equality at parent leave scheme is not achieved. To sum up, care work support policy is not completely based on gender-equality participation, but it is sure parents are truly responsible for care work. Thirdly, in case of Korea, effective gender-balance policy such as male`s familization in the area of care work support isn``t introduced. It is difficult for Korean male to join the child care work due to their long working hours. In particular, regarding participation in maternity leave scheme of Korea, women are responsible for care-work. But right of women and men to care-work is not guaranteed and thereby the possibility of work-family balance is not likely. In conclusion, when care work support policy and gender regime are simultaneously implemented on the basis of holistic approach of care and possibility of gender-equality work-family balance are much likely in Korea and Southern Europe. Those countries are affiliated to residual welfare provision including conservatism.","복지체제, 젠더관점, 남부유럽, 가족정책 비교, welfare regime, gender regime, Southern Europe, care work support policy comparative study, parent Leave",27 ~ 53,http://kiss.kstudy.com/search/detail_page.asp?key=2916705
